<?xml version="1.0" encoding="UTF-8"?>
<!DOCTYPE parc SYSTEM "animaux.dtd">
<parc>
  <nom>Parc animalier de Val-Sorin</nom>
  <secteur code="SAV" surface="30000">
    <nom>Savane</nom>
    <description>Grande plaine herbeuse de trois hectares, girafes, zèbres et autruches en cohabitation.</description>
    <animal id="1" statut="visible">
      <espece>Girafe</espece>
      <nom>Zara</nom>
      <naissance>2019-04-12</naissance>
      <regime>herbivore</regime>
      <description>Femelle de quatre mètres, reconnaissable à sa tache en forme de cœur sur l'épaule gauche.</description>
    </animal>
    <animal id="2" statut="visible">
      <espece>Girafe</espece>
      <nom>Nino</nom>
      <naissance>2024-11-03</naissance>
      <regime>herbivore</regime>
      <description>Jeune mâle né au parc, encore proche de sa mère Zara.</description>
    </animal>
    <animal id="3" statut="visible">
      <espece>Zèbre de Grévy</espece>
      <nom>Pablo</nom>
      <naissance>2017-06-21</naissance>
      <regime>herbivore</regime>
      <description>Le plus âgé du groupe, meneur du troupeau.</description>
    </animal>
    <animal id="4" statut="visible">
      <espece>Zèbre de Grévy</espece>
      <nom>Iris</nom>
      <naissance>2021-03-09</naissance>
      <regime>herbivore</regime>
      <description>Curieuse, s'approche souvent de la vitre d'observation.</description>
    </animal>
    <animal id="5" statut="visible">
      <espece>Autruche</espece>
      <nom>Gaston</nom>
      <naissance>2018-09-30</naissance>
      <regime>omnivore</regime>
      <description>Deux mètres cinquante, court à soixante-dix kilomètres à l'heure dans l'enclos.</description>
    </animal>
    <animal id="6" statut="soins">
      <espece>Rhinocéros blanc</espece>
      <nom>Tembo</nom>
      <naissance>2012-01-15</naissance>
      <regime>herbivore</regime>
      <description>En soins pour une blessure au pied, visible depuis la passerelle nord seulement.</description>
    </animal>
    <animal id="7" statut="visible">
      <espece>Suricate</espece>
      <nom>Groupe Kalahari</nom>
      <naissance>2022-05-05</naissance>
      <regime>insectivore</regime>
      <description>Colonie de douze individus, toujours une sentinelle debout.</description>
    </animal>
  </secteur>
  <secteur code="TRO" surface="4200">
    <nom>Forêt tropicale</nom>
    <description>Serre chaude et humide, canopée artificielle, singes, paresseux et oiseaux colorés.</description>
    <animal id="8" statut="visible">
      <espece>Capucin</espece>
      <nom>Tico</nom>
      <naissance>2016-08-19</naissance>
      <regime>omnivore</regime>
      <description>Chef de groupe, ouvre les noix avec une pierre.</description>
    </animal>
    <animal id="9" statut="visible">
      <espece>Capucin</espece>
      <nom>Lua</nom>
      <naissance>2025-12-20</naissance>
      <regime>omnivore</regime>
      <description>Bébé de l'hiver dernier, encore porté par sa mère.</description>
    </animal>
    <animal id="10" statut="visible">
      <espece>Paresseux</espece>
      <nom>Domingo</nom>
      <naissance>2015-02-28</naissance>
      <regime>herbivore</regime>
      <description>Dort dix-huit heures par jour dans le même arbre depuis dix ans.</description>
    </animal>
    <animal id="11" statut="visible">
      <espece>Toucan toco</espece>
      <nom>Carmen</nom>
      <naissance>2020-07-07</naissance>
      <regime>frugivore</regime>
      <description>Bec orange de vingt centimètres, mange des papayes en vol.</description>
    </animal>
    <animal id="12" statut="visible">
      <espece>Iguane vert</espece>
      <nom>Verdi</nom>
      <naissance>2019-10-10</naissance>
      <regime>herbivore</regime>
      <description>Un mètre soixante, immobile sur sa branche chauffée.</description>
    </animal>
    <animal id="13" statut="visible">
      <espece>Anaconda</espece>
      <nom>Sissi</nom>
      <naissance>2014-04-01</naissance>
      <regime>carnivore</regime>
      <description>Quatre mètres, nourrie une fois par mois, souvent dans l'eau.</description>
    </animal>
    <animal id="14" statut="soins">
      <espece>Ara bleu</espece>
      <nom>Rio</nom>
      <naissance>2018-03-03</naissance>
      <regime>frugivore</regime>
      <description>Perte de plumes en cours de traitement, en volière de repos.</description>
    </animal>
  </secteur>
  <secteur code="BAN" surface="1800">
    <nom>Banquise</nom>
    <description>Bassin réfrigéré avec plage de glace, manchots et phoques.</description>
    <animal id="15" statut="visible">
      <espece>Manchot de Humboldt</espece>
      <nom>Pingu</nom>
      <naissance>2020-11-11</naissance>
      <regime>piscivore</regime>
      <description>Plonge à chaque nourrissage de onze heures.</description>
    </animal>
    <animal id="16" statut="visible">
      <espece>Manchot de Humboldt</espece>
      <nom>Flocon</nom>
      <naissance>2026-01-18</naissance>
      <regime>piscivore</regime>
      <description>Né cet hiver, premier manchot éclos au parc.</description>
    </animal>
    <animal id="17" statut="visible">
      <espece>Manchot de Humboldt</espece>
      <nom>Olga</nom>
      <naissance>2019-12-24</naissance>
      <regime>piscivore</regime>
      <description>Mère de Flocon, très territoriale sur son nid.</description>
    </animal>
    <animal id="18" statut="visible">
      <espece>Phoque gris</espece>
      <nom>Bruno</nom>
      <naissance>2013-05-14</naissance>
      <regime>piscivore</regime>
      <description>Deux cents kilos, adore le tunnel de verre.</description>
    </animal>
    <animal id="19" statut="visible">
      <espece>Phoque gris</espece>
      <nom>Maya</nom>
      <naissance>2023-06-30</naissance>
      <regime>piscivore</regime>
      <description>Jeune femelle joueuse, nourrie à la main lors des animations.</description>
    </animal>
  </secteur>
  <secteur code="FER" surface="2500">
    <nom>Ferme pédagogique</nom>
    <description>Enclos ouverts au contact, chèvres, ânes et poules, ateliers pour les scolaires.</description>
    <animal id="20" statut="visible">
      <espece>Chèvre naine</espece>
      <nom>Biscotte</nom>
      <naissance>2021-02-14</naissance>
      <regime>herbivore</regime>
      <description>Grimpe sur tout ce qui dépasse, mascotte des scolaires.</description>
    </animal>
    <animal id="21" statut="visible">
      <espece>Chèvre naine</espece>
      <nom>Caramel</nom>
      <naissance>2026-03-02</naissance>
      <regime>herbivore</regime>
      <description>Chevreau du printemps, tête toute noire.</description>
    </animal>
    <animal id="22" statut="visible">
      <espece>Âne du Poitou</espece>
      <nom>Ulysse</nom>
      <naissance>2011-08-08</naissance>
      <regime>herbivore</regime>
      <description>Longs poils bruns emmêlés, promène les enfants le mercredi.</description>
    </animal>
    <animal id="23" statut="visible">
      <espece>Poule de Marans</espece>
      <nom>Groupe basse-cour</nom>
      <naissance>2024-04-04</naissance>
      <regime>omnivore</regime>
      <description>Huit poules aux œufs chocolat, ramassés à quatorze heures.</description>
    </animal>
    <animal id="24" statut="visible">
      <espece>Lapin bélier</espece>
      <nom>Moka</nom>
      <naissance>2023-09-09</naissance>
      <regime>herbivore</regime>
      <description>Oreilles tombantes, atelier caresses le samedi.</description>
    </animal>
  </secteur>
  <secteur code="VOL" surface="1500">
    <nom>Grande volière</nom>
    <description>Volière de vingt mètres de haut traversée par une passerelle, rapaces et perroquets.</description>
    <animal id="25" statut="visible">
      <espece>Vautour fauve</espece>
      <nom>Attila</nom>
      <naissance>2010-06-06</naissance>
      <regime>charognard</regime>
      <description>Deux mètres soixante d'envergure, nourri à quinze heures.</description>
    </animal>
    <animal id="26" statut="visible">
      <espece>Perroquet gris du Gabon</espece>
      <nom>Coco</nom>
      <naissance>2017-01-30</naissance>
      <regime>frugivore</regime>
      <description>Imite la sonnerie du téléphone de l'accueil.</description>
    </animal>
    <animal id="27" statut="visible">
      <espece>Chouette effraie</espece>
      <nom>Luna</nom>
      <naissance>2022-10-31</naissance>
      <regime>carnivore</regime>
      <description>Visible surtout à la tombée du jour, vol totalement silencieux.</description>
    </animal>
    <animal id="28" statut="visible">
      <espece>Flamant rose</espece>
      <nom>Groupe lagune</nom>
      <naissance>2015-05-05</naissance>
      <regime>omnivore</regime>
      <description>Vingt-deux flamants, couleur due aux crevettes de leur alimentation.</description>
    </animal>
  </secteur>
  <secteur code="AQU" surface="900">
    <nom>Aquarium</nom>
    <description>Douze bassins d'eau douce et d'eau de mer, tunnel sous le bassin des raies.</description>
    <animal id="29" statut="visible">
      <espece>Raie pastenague</espece>
      <nom>Vega</nom>
      <naissance>2018-02-02</naissance>
      <regime>carnivore</regime>
      <description>Passe au-dessus du tunnel toutes les dix minutes.</description>
    </animal>
    <animal id="30" statut="visible">
      <espece>Hippocampe</espece>
      <nom>Groupe récif</nom>
      <naissance>2025-08-15</naissance>
      <regime>carnivore</regime>
      <description>Vingt individus, les mâles portent les œufs.</description>
    </animal>
    <animal id="31" statut="visible">
      <espece>Poisson-clown</espece>
      <nom>Groupe anémones</nom>
      <naissance>2024-06-01</naissance>
      <regime>omnivore</regime>
      <description>Trente poissons dans leurs anémones, bassin numéro 4.</description>
    </animal>
    <animal id="32" statut="soins">
      <espece>Piranha rouge</espece>
      <nom>Groupe Amazone</nom>
      <naissance>2021-07-21</naissance>
      <regime>carnivore</regime>